{
  "id": "module-orthogonality-review",
  "module": "module-orthogonality",
  "title": {
    "ja": "直交性と最小二乗 Module演習",
    "en": "Orthogonality Module Review"
  },
  "exercises": [
    {
      "id": "module-orthogonality-exercise-basic",
      "type": "calculation",
      "difficulty": "basic",
      "question": "orthogonalityについて、このModuleで使う基本的な定義または計算規則を一つ書き、小さな例で確認せよ。",
      "solution": {
        "what_is_asked": "直交性と最小二乗のorthogonalityについて、calculationを行う。",
        "concepts": [
          "orthogonality"
        ],
        "strategy": "orthogonalityの定義を式にし、例へ代入する。",
        "steps": [
          "対象の次元・条件・記号を確認する。",
          "orthogonalityの定義を式にし、例へ代入する。",
          "小さな例または定義へ戻って結果を検算する。"
        ],
        "why": [
          "条件を先に固定すると、似た記号や異なる規約を混同しにくい。",
          "最後に意味へ戻ることで、答えが単なる数値で終わらない。"
        ],
        "conclusion": "orthogonalityの定義を明示し、例の各ステップを計算できる。",
        "common_wrong_path": "用語だけを答え、対象や条件を示さない。"
      }
    },
    {
      "id": "module-orthogonality-exercise-conceptual",
      "type": "explanation",
      "difficulty": "standard",
      "question": "orthogonalityとorthogonal complementの関係を、計算・幾何・構造のうち二つの観点で説明せよ。",
      "solution": {
        "what_is_asked": "直交性と最小二乗のorthogonality・orthogonal complementについて、explanationを行う。",
        "concepts": [
          "orthogonality・orthogonal complement"
        ],
        "strategy": "二つの語を別々に定義してから、共通する例の中で接続する。",
        "steps": [
          "対象の次元・条件・記号を確認する。",
          "二つの語を別々に定義してから、共通する例の中で接続する。",
          "小さな例または定義へ戻って結果を検算する。"
        ],
        "why": [
          "条件を先に固定すると、似た記号や異なる規約を混同しにくい。",
          "最後に意味へ戻ることで、答えが単なる数値で終わらない。"
        ],
        "conclusion": "orthogonalityを定義し、orthogonal complementがその結果をどう利用するかを、式または具体例付きで説明する。",
        "common_wrong_path": "似た言葉を同義語として扱い、条件の違いを消す。"
      }
    },
    {
      "id": "module-orthogonality-exercise-synthesis",
      "type": "synthesis",
      "difficulty": "challenge",
      "question": "orthogonalityからpseudoinverseまでの学習内容を使う、小さな総合問題を設計し、解法と検算を示せ。",
      "solution": {
        "what_is_asked": "直交性と最小二乗のorthogonality・pseudoinverseについて、synthesisを行う。",
        "concepts": [
          "orthogonality・pseudoinverse"
        ],
        "strategy": "出発条件→中間表現→最終計算→解釈の順に分解する。",
        "steps": [
          "対象の次元・条件・記号を確認する。",
          "出発条件→中間表現→最終計算→解釈の順に分解する。",
          "小さな例または定義へ戻って結果を検算する。"
        ],
        "why": [
          "条件を先に固定すると、似た記号や異なる規約を混同しにくい。",
          "最後に意味へ戻ることで、答えが単なる数値で終わらない。"
        ],
        "conclusion": "orthogonalityの条件を出発点に、pseudoinverseへ至る三段階以上の推論を示し、最後に元の条件へ戻って検算する。",
        "common_wrong_path": "最後の公式だけを適用し、前提条件や中間結果を省略する。"
      }
    }
  ]
}
