{
  "id": "module-linear-transformations-review",
  "module": "module-linear-transformations",
  "title": {
    "ja": "線形写像で構造を見る Module演習",
    "en": "Linear Transformations Module Review"
  },
  "exercises": [
    {
      "id": "module-linear-transformations-exercise-basic",
      "type": "calculation",
      "difficulty": "basic",
      "question": "linear transformationについて、このModuleで使う基本的な定義または計算規則を一つ書き、小さな例で確認せよ。",
      "solution": {
        "what_is_asked": "線形写像で構造を見るのlinear transformationについて、calculationを行う。",
        "concepts": [
          "linear transformation"
        ],
        "strategy": "linear transformationの定義を式にし、例へ代入する。",
        "steps": [
          "対象の次元・条件・記号を確認する。",
          "linear transformationの定義を式にし、例へ代入する。",
          "小さな例または定義へ戻って結果を検算する。"
        ],
        "why": [
          "条件を先に固定すると、似た記号や異なる規約を混同しにくい。",
          "最後に意味へ戻ることで、答えが単なる数値で終わらない。"
        ],
        "conclusion": "linear transformationの定義を明示し、例の各ステップを計算できる。",
        "common_wrong_path": "用語だけを答え、対象や条件を示さない。"
      }
    },
    {
      "id": "module-linear-transformations-exercise-conceptual",
      "type": "explanation",
      "difficulty": "standard",
      "question": "linear transformationとkernelの関係を、計算・幾何・構造のうち二つの観点で説明せよ。",
      "solution": {
        "what_is_asked": "線形写像で構造を見るのlinear transformation・kernelについて、explanationを行う。",
        "concepts": [
          "linear transformation・kernel"
        ],
        "strategy": "二つの語を別々に定義してから、共通する例の中で接続する。",
        "steps": [
          "対象の次元・条件・記号を確認する。",
          "二つの語を別々に定義してから、共通する例の中で接続する。",
          "小さな例または定義へ戻って結果を検算する。"
        ],
        "why": [
          "条件を先に固定すると、似た記号や異なる規約を混同しにくい。",
          "最後に意味へ戻ることで、答えが単なる数値で終わらない。"
        ],
        "conclusion": "linear transformationを定義し、kernelがその結果をどう利用するかを、式または具体例付きで説明する。",
        "common_wrong_path": "似た言葉を同義語として扱い、条件の違いを消す。"
      }
    },
    {
      "id": "module-linear-transformations-exercise-synthesis",
      "type": "synthesis",
      "difficulty": "challenge",
      "question": "linear transformationからsimilarityまでの学習内容を使う、小さな総合問題を設計し、解法と検算を示せ。",
      "solution": {
        "what_is_asked": "線形写像で構造を見るのlinear transformation・similarityについて、synthesisを行う。",
        "concepts": [
          "linear transformation・similarity"
        ],
        "strategy": "出発条件→中間表現→最終計算→解釈の順に分解する。",
        "steps": [
          "対象の次元・条件・記号を確認する。",
          "出発条件→中間表現→最終計算→解釈の順に分解する。",
          "小さな例または定義へ戻って結果を検算する。"
        ],
        "why": [
          "条件を先に固定すると、似た記号や異なる規約を混同しにくい。",
          "最後に意味へ戻ることで、答えが単なる数値で終わらない。"
        ],
        "conclusion": "linear transformationの条件を出発点に、similarityへ至る三段階以上の推論を示し、最後に元の条件へ戻って検算する。",
        "common_wrong_path": "最後の公式だけを適用し、前提条件や中間結果を省略する。"
      }
    }
  ]
}
